{
  "$schema": "https://json-schema.org/draft/2020-12/schema",
  "$id": "https://index.ocx.sh/schema/root.schema.json",
  "title": "OCX Index Package Root",
  "description": "Hot, mutable package root at /p/<namespace>/<package>.json (ADR: adr_locked_observation_index_format.md D2). Governance fields (name, repository, owners, status, deprecated_message, superseded_by, created, upstream) are human-set via PR; desc and tags[*] (except tags[*].yanked) are bot-regenerated from observed registry state.",
  "type": "object",
  "properties": {
    "name": {
      "type": "string",
      "description": "Logical package name, ocx.sh/<namespace>/<package>.",
      "pattern": "^ocx\\.sh/[a-z0-9](?:[a-z0-9]|-(?=[a-z0-9])){0,38}/[a-z0-9]+((\\.|_|__|-+)[a-z0-9]+)*$",
      "maxLength": 147
    },
    "repository": {
      "type": "string",
      "description": "Physical OCI repository this entry points to, oci://<host>/<repo path>. Host is validated against an allowlist at CI time (ADR: adr_index_bot_and_workflow_security.md) — this pattern only fixes the URI shape.",
      "pattern": "^oci://[a-z0-9]([a-z0-9-]*[a-z0-9])?(\\.[a-z0-9]([a-z0-9-]*[a-z0-9])?)*(:[0-9]{1,5})?/[a-z0-9]+((\\.|_|__|-+)[a-z0-9]+)*(/[a-z0-9]+((\\.|_|__|-+)[a-z0-9]+)*)*$"
    },
    "owners": {
      "type": "array",
      "minItems": 1,
      "items": { "$ref": "#/$defs/owner" }
    },
    "status": {
      "type": "string",
      "enum": ["active", "deprecated", "yanked"]
    },
    "deprecated_message": {
      "type": ["string", "null"]
    },
    "superseded_by": {
      "type": ["string", "null"],
      "description": "Human-governed pointer to the successor package, bare <namespace>/<package> (no ocx.sh/ prefix). Omitted (or null) when unset.",
      "pattern": "^[a-z0-9](?:[a-z0-9]|-(?=[a-z0-9])){0,38}/[a-z0-9]+((\\.|_|__|-+)[a-z0-9]+)*$",
      "maxLength": 140
    },
    "created": {
      "type": "string",
      "pattern": "^\\d{4}-\\d{2}-\\d{2}$",
      "description": "Date the entry was first claimed, set once."
    },
    "upstream": {
      "$ref": "#/$defs/upstream",
      "description": "Attribution of the real upstream vendor/project the namespace names. Mandatory (by governance, not by this schema) on every entry whose namespace names a real third-party vendor; omitted only for OCX's own first-party namespaces (ADR: adr_namespace_policy.md ND-9/ND-10)."
    },
    "source": {
      "type": ["string", "null"],
      "description": "Repository whose CI produced the published builds — bot-derived from the org.opencontainers.image.source annotation on the latest version's observed manifest, never human-set. NOT upstream.repository_url: that one is human-governed and names the third-party vendor the namespace attributes, while this one names the build's own origin — for a mirror the two are different repositories on purpose. Restricted to https:// (deliberately tighter than upstream.repository_url's format: uri, which also admits javascript:/data:) because this value is publisher-controlled and lands as an href on a public page; the site re-checks it with utils/safeHref.ts before rendering. Optional and omitted (or null) when the annotation is absent — never in required, so every root published before this field existed stays valid.",
      "pattern": "^https://[^\\s]+$",
      "maxLength": 2048
    },
    "variants": {
      "type": "array",
      "description": "Variant names observed across tags — the sorted, deduplicated set of `<variant>-` prefixes carried by tags that parse as versions. Bot-derived, never human-set: a pure projection of `tags` — enforced, not merely described, by check_variants_match_tags in bot/src/indexbot/core/validate_entry.py, which re-derives from this root's own tags at PR time and rejects a present field that disagrees (JSON Schema can constrain the shape but not the relationship). Omitting it is always allowed — an absent field claims nothing. recorded so a consumer can learn a package ships variants without re-implementing the version grammar. Omitted (never `[]`) when the package ships only the default variant, so every root published before this field existed stays valid AND byte-identical. The default variant is the absence of a prefix and has no name here, so this array never contains an empty string. A bare rolling tag (`slim`) is not a version and so never appears: it becomes legible as a variant only alongside a versioned `slim-*` sibling, an inference the display layer makes and this field does not.",
      "minItems": 1,
      "uniqueItems": true,
      "items": {
        "type": "string",
        "pattern": "^[a-z][a-z0-9.]*$",
        "not": { "const": "latest" },
        "description": "One variant name, matching the version grammar's prefix production. `latest` is reserved: `Version::parse` refuses it as a prefix, so a tag named `latest-3.28.1` is not a version and yields no variant. The `not` fails a hand-authored root closed — the byte gate is a round-trip and would happily accept a fabricated name the derivation could never produce."
      }
    },
    "desc": {
      "description": "Nullable — a package that has never published __ocx.desc on the physical registry has desc: null (ADR: adr_locked_observation_index_format.md D6).",
      "oneOf": [
        { "type": "null" },
        { "$ref": "#/$defs/desc" }
      ]
    },
    "tags": {
      "type": "object",
      "description": "Every version tag observed on the physical repository. Two tags are aliases of each other exactly when their content digests are equal (emergent aliasing, no declared aliases field). Reserved tags are not versions and never appear here: the OCX-internal __ocx* namespace, and canonical <algorithm>.<hex> digest-alias tags, which are digest-addressed rather than version pointers.",
      "propertyNames": {
        "$comment": "The first pattern is the OCI distribution tag grammar. The `not` is the D7 reservation, and this schema is the PR-time admission gate for hand-authored content — but it documents intent rather than expressing the whole rule: JSON Schema regexes are ECMA-262, which has no inline case-insensitivity flag (hence the spelled-out [oO][cC][xX] case-fold) and cannot express the semantic parts. The real gate is check_no_reserved_tags in bot/src/indexbot/core/validate_entry.py, which every PR passes through.",
        "pattern": "^[a-zA-Z0-9_][a-zA-Z0-9._-]{0,127}$",
        "not": {
          "anyOf": [
            { "pattern": "^__[oO][cC][xX]" },
            { "pattern": "^sha256\\.[0-9a-fA-F]{64}$" },
            { "pattern": "^sha384\\.[0-9a-fA-F]{96}$" },
            { "pattern": "^sha512\\.[0-9a-fA-F]{128}$" }
          ]
        }
      },
      "additionalProperties": { "$ref": "#/$defs/tagEntry" }
    }
  },
  "required": [
    "name",
    "repository",
    "owners",
    "status",
    "deprecated_message",
    "created",
    "desc",
    "tags"
  ],
  "additionalProperties": false,
  "$defs": {
    "sha256Digest": {
      "type": "string",
      "pattern": "^sha256:[a-f0-9]{64}$",
      "description": "OCI-style content digest, algorithm sha256, lowercase hex."
    },
    "zAnchoredTimestamp": {
      "type": "string",
      "pattern": "^\\d{4}-\\d{2}-\\d{2}T\\d{2}:\\d{2}:\\d{2}Z$",
      "description": "ISO 8601 UTC instant, Z-anchored and fixed-width (YYYY-MM-DDThh:mm:ssZ) — deliberately tighter than bare `format: date-time`, which also admits numeric-offset forms like `+02:00`. Every timestamp in this schema shares this one fixed shape on purpose: `core/render.py`'s `generated` field is a lexicographic string max over every `observed`/`yanked.at` value, valid only when every candidate string shares this exact shape (lexicographic order == chronological order). Offsets are deliberately excluded, not merely unhandled. Enforced at the input boundary by `core/validate_entry.py`'s `check_tag_timestamps_z_anchored` (bare JSON Schema cannot itself express 'reject only the numeric-offset form of an otherwise-valid RFC 3339 date-time')."
    },
    "owner": {
      "type": "object",
      "description": "One namespace owner. `login`/`id` are canonical since ocx-indexbot 0.5.0; `github`/`github_id` are the pre-0.5.0 spelling, still accepted on read and emitted derived from the canonical pair. Either pair alone satisfies this schema (an index published before 0.5.0 carries only the legacy one); a root this bot writes carries both. See adr_forge_neutral_owners.md.",
      "properties": {
        "login": {
          "type": "string",
          "pattern": "^[A-Za-z0-9][A-Za-z0-9._-]{0,254}$",
          "description": "The owner's forge USERNAME — the handle a forge API resolves to a user id — never a display name. `ForgePort.request_reviewers` hands this exact string to the forge; on GitLab that is `GET /users?username=<login>`, whose `name` field is a different thing (the human's full name), and requesting review by display name resolves to nobody. Deliberately wider than GitHub's own login grammar: this index's roots may name a GitLab account, and GitLab usernames admit `.` and `_` (`project_85719502_bot_…`). Display and review-request only — not the ownership key."
        },
        "id": {
          "type": "integer",
          "minimum": 1,
          "description": "The owner's numeric forge user id, and THE ownership key: G-19 matches a pull request author against this and never against `login`. Mandatory because it survives a forge username rename or recycling, which the login string does not."
        },
        "github": {
          "type": "string",
          "pattern": "^[A-Za-z0-9][A-Za-z0-9._-]{0,254}$",
          "description": "Pre-0.5.0 spelling of `login`. Derived from it on write, never independently settable; `parse_package_root` refuses a root where the two disagree."
        },
        "github_id": {
          "type": "integer",
          "minimum": 1,
          "description": "Pre-0.5.0 spelling of `id`. Derived from it on write, never independently settable; `parse_package_root` refuses a root where the two disagree."
        }
      },
      "anyOf": [
        { "required": ["login", "id"] },
        { "required": ["github", "github_id"] }
      ],
      "additionalProperties": false
    },
    "upstream": {
      "type": "object",
      "description": "Attribution of the real upstream vendor the namespace names, distinct from the namespace owner (owners[]).",
      "properties": {
        "org": { "type": "string", "minLength": 1 },
        "repository_url": { "type": "string", "format": "uri" },
        "disclaimer": { "type": ["string", "null"] }
      },
      "required": ["org"],
      "additionalProperties": false
    },
    "desc": {
      "type": "object",
      "properties": {
        "digest": {
          "$ref": "#/$defs/sha256Digest",
          "description": "Digest of the currently observed __ocx.desc internal tag, used to detect change and avoid gratuitous re-copy."
        },
        "title": { "type": "string", "minLength": 1 },
        "description": { "type": "string" },
        "keywords": {
          "type": "array",
          "items": { "type": "string", "minLength": 1 },
          "description": "Sourced from the sh.ocx.keywords annotation; packages that never publish it render []."
        },
        "readme": {
          "$ref": "#/$defs/sha256Digest",
          "description": "CAS digest of the copied readme blob (o/sha256/<hex>.md)."
        },
        "logo": {
          "$ref": "#/$defs/sha256Digest",
          "description": "CAS digest of the copied logo blob (o/sha256/<hex>.svg or .png)."
        }
      },
      "required": ["digest", "title", "description", "keywords"],
      "additionalProperties": false
    },
    "tagEntry": {
      "type": "object",
      "properties": {
        "content": {
          "$ref": "#/$defs/sha256Digest",
          "description": "Digest of the OCI image index this tag resolved to, as served by the physical registry; those bytes are stored verbatim at o/<algo>/<hex>.json. Never absent: every tag entry names an index that is present in the CAS."
        },
        "observed": { "$ref": "#/$defs/zAnchoredTimestamp" },
        "yanked": {
          "$ref": "#/$defs/yanked",
          "description": "Presence marks the row yanked. Human-set via PR; bot never writes this field."
        },
        "ephemeral": {
          "const": true,
          "description": "Set when the tag was announced with --ephemeral. Removal of this row merges without review once the registry confirms the tag is gone. Absence means durable."
        }
      },
      "required": ["content", "observed"],
      "additionalProperties": false
    },
    "yanked": {
      "type": "object",
      "properties": {
        "reason": { "type": "string", "minLength": 1 },
        "at": { "$ref": "#/$defs/zAnchoredTimestamp" }
      },
      "required": ["reason", "at"],
      "additionalProperties": false
    }
  }
}
