{
  "name": "ocx.sh/watchexec/watchexec",
  "repository": "oci://ghcr.io/ocx-contrib/watchexec/watchexec",
  "owners": [
    {
      "login": "ocx-bot",
      "id": 309019509
    }
  ],
  "status": "active",
  "deprecated_message": null,
  "created": "2026-08-04",
  "desc": {
    "digest": "sha256:b02cda8c851e1810d6d201d49bb26da34511b9a91a29d0f260216e654fa816cc",
    "title": "watchexec",
    "description": "Executes commands in response to file modifications \u2014 a fast, language-agnostic file watcher for rebuild, reload and re-test loops",
    "keywords": [
      "watchexec",
      "watch",
      "file-watcher",
      "filesystem",
      "rebuild",
      "reload",
      "live-reload",
      "hot-reload",
      "automation",
      "cli",
      "rust"
    ],
    "readme": "sha256:e8059a1462002ef5dacc67d8f6049b2249da6011aca2861a68148bf436b97ec1",
    "logo": "sha256:69556600fe01d5c78a006edd338976e5b4e30a189bdd3a517af97387e1263032"
  },
  "upstream": {
    "org": "watchexec",
    "repository_url": "https://github.com/watchexec/watchexec",
    "disclaimer": "Unaffiliated mirror. watchexec is a project of F\u00e9lix Saparelli, Matt Green and the watchexec organization; this OCX package republishes upstream release binaries and is not endorsed by them."
  },
  "tags": {
    "2.4.3_20260804": {
      "content": "sha256:907cdd4e3550d49bd430aaf5d91927cb2bc86707955bff36d1ecffbadb3c1716",
      "observed": "2026-08-04T07:08:23Z"
    },
    "2.4.3": {
      "content": "sha256:907cdd4e3550d49bd430aaf5d91927cb2bc86707955bff36d1ecffbadb3c1716",
      "observed": "2026-08-04T07:08:23Z"
    },
    "2.4": {
      "content": "sha256:907cdd4e3550d49bd430aaf5d91927cb2bc86707955bff36d1ecffbadb3c1716",
      "observed": "2026-08-04T07:08:23Z"
    },
    "2": {
      "content": "sha256:ab8d3048287521869cac29ba3052120c48f3ee95a2a8115760d7cb557168655d",
      "observed": "2026-10-03T01:16:03Z"
    },
    "latest": {
      "content": "sha256:ab8d3048287521869cac29ba3052120c48f3ee95a2a8115760d7cb557168655d",
      "observed": "2026-10-03T01:16:03Z"
    },
    "2.5.0_20260804": {
      "content": "sha256:7ccd1ed4b637a592c947de06f7ceb3f89cfa4e7c011e0cc3d9c7116f33555d15",
      "observed": "2026-08-04T07:08:23Z"
    },
    "2.5.0": {
      "content": "sha256:7ccd1ed4b637a592c947de06f7ceb3f89cfa4e7c011e0cc3d9c7116f33555d15",
      "observed": "2026-08-04T07:08:23Z"
    },
    "2.5": {
      "content": "sha256:10405f6cf815d30f44b4187c7f39ccc641d4c06c51a5e2c542100a2f4017f0e6",
      "observed": "2026-08-04T07:08:23Z"
    },
    "2.5.1_20260804": {
      "content": "sha256:10405f6cf815d30f44b4187c7f39ccc641d4c06c51a5e2c542100a2f4017f0e6",
      "observed": "2026-08-04T07:08:23Z"
    },
    "2.5.1": {
      "content": "sha256:10405f6cf815d30f44b4187c7f39ccc641d4c06c51a5e2c542100a2f4017f0e6",
      "observed": "2026-08-04T07:08:23Z"
    },
    "2.6.1_20260822": {
      "content": "sha256:e8c55f9c06dda21c292dc1cea7afbde3da698c7640f3a50fb730fd2fa65bfb8a",
      "observed": "2026-08-22T16:46:10Z"
    },
    "2.6.1_20260823": {
      "content": "sha256:50dac6f47ceda6c8420f5c7b5de652b208e3807e1e9492945b3a95bc981fe6ec",
      "observed": "2026-09-02T21:36:53Z"
    },
    "2.6.1": {
      "content": "sha256:50dac6f47ceda6c8420f5c7b5de652b208e3807e1e9492945b3a95bc981fe6ec",
      "observed": "2026-09-02T21:36:53Z"
    },
    "2.6": {
      "content": "sha256:50dac6f47ceda6c8420f5c7b5de652b208e3807e1e9492945b3a95bc981fe6ec",
      "observed": "2026-09-02T21:36:53Z"
    },
    "2.7.0_20260824": {
      "content": "sha256:f28104b6fb769647d28b0e1448d6635dc7c746d66c38347ca958fa86c72ce30a",
      "observed": "2026-09-02T21:36:53Z"
    },
    "2.7.0": {
      "content": "sha256:f28104b6fb769647d28b0e1448d6635dc7c746d66c38347ca958fa86c72ce30a",
      "observed": "2026-09-02T21:36:53Z"
    },
    "2.7": {
      "content": "sha256:ab8d3048287521869cac29ba3052120c48f3ee95a2a8115760d7cb557168655d",
      "observed": "2026-10-03T01:16:03Z"
    },
    "2.7.1_20260903": {
      "content": "sha256:f1857a45a6285028e917c4ee9a7f73e6c757b0b80fbbdf6ac58c52c1941a7293",
      "observed": "2026-09-03T14:40:22Z"
    },
    "2.7.1": {
      "content": "sha256:f1857a45a6285028e917c4ee9a7f73e6c757b0b80fbbdf6ac58c52c1941a7293",
      "observed": "2026-09-03T14:40:22Z"
    },
    "2.7.2_20260906": {
      "content": "sha256:79531b2a0b1fcd3bf833aa210aae573f0de37aa9c8aefa5bbf0d183cd53b55db",
      "observed": "2026-09-06T08:45:19Z"
    },
    "2.7.2": {
      "content": "sha256:79531b2a0b1fcd3bf833aa210aae573f0de37aa9c8aefa5bbf0d183cd53b55db",
      "observed": "2026-09-06T08:45:19Z"
    },
    "2.7.3_20260915": {
      "content": "sha256:e23dcdcf6f984869ad1e3da2a302c65d14b29b2e45a1b7501fd762786e9fcdad",
      "observed": "2026-09-15T15:06:52Z"
    },
    "2.7.3": {
      "content": "sha256:e23dcdcf6f984869ad1e3da2a302c65d14b29b2e45a1b7501fd762786e9fcdad",
      "observed": "2026-09-15T15:06:52Z"
    },
    "2.7.4_20261002": {
      "content": "sha256:7354ad6b5e0d5218e353cfc703e00f52b7dff691fc178df02722c4c8eae21ebe",
      "observed": "2026-10-02T20:50:47Z"
    },
    "2.7.4_20261003": {
      "content": "sha256:ab8d3048287521869cac29ba3052120c48f3ee95a2a8115760d7cb557168655d",
      "observed": "2026-10-03T01:16:03Z"
    },
    "2.7.4": {
      "content": "sha256:ab8d3048287521869cac29ba3052120c48f3ee95a2a8115760d7cb557168655d",
      "observed": "2026-10-03T01:16:03Z"
    }
  }
}
