{
  "name": "ocx.sh/prek/prek",
  "repository": "oci://ghcr.io/ocx-contrib/prek/prek",
  "owners": [
    {
      "login": "ocx-bot",
      "id": 309019509
    }
  ],
  "status": "active",
  "deprecated_message": null,
  "created": "2026-08-04",
  "desc": {
    "digest": "sha256:fc76660a0a63e4bd92cd711d0efec266404343c71d392eeac0d21964964c8bae",
    "title": "prek",
    "description": "A fast Git hook manager written in Rust \u2014 a drop-in, dependency-free alternative to pre-commit",
    "keywords": [
      "prek",
      "pre-commit",
      "git",
      "git-hooks",
      "hooks",
      "lint",
      "formatter",
      "ci",
      "rust",
      "cli"
    ],
    "readme": "sha256:bef609f7e7eae5f497d80fe0dda554aa900945366656d19a77063d29a1d1ec09",
    "logo": "sha256:5fb6ce2145bab576b63a5f96cdcb7e7a7d0faaa8c772a920387cc6940de928c2"
  },
  "upstream": {
    "org": "j178",
    "repository_url": "https://github.com/j178/prek",
    "disclaimer": "Unaffiliated mirror. prek is a project of j178; this OCX package republishes upstream release binaries and is not endorsed by them."
  },
  "tags": {
    "0.4.10_20260804": {
      "content": "sha256:004be9383ffcda5d51a6ffb71344b082ddcbe7d2ef8b96f0b24c6019577c1971",
      "observed": "2026-08-04T01:02:01Z"
    },
    "0.4.10": {
      "content": "sha256:004be9383ffcda5d51a6ffb71344b082ddcbe7d2ef8b96f0b24c6019577c1971",
      "observed": "2026-08-04T01:02:01Z"
    },
    "0.4": {
      "content": "sha256:7d833ef37803991f637c977b52d04a6e593ee7f8adc7caf5a5fc2cbf7bc7e340",
      "observed": "2026-08-17T08:28:34Z"
    },
    "0": {
      "content": "sha256:c00983250f9cb752faccff07f7d25aa4aea554d1f4afac7ee0b4915cc6bbc2d6",
      "observed": "2026-09-28T07:45:30Z"
    },
    "latest": {
      "content": "sha256:c00983250f9cb752faccff07f7d25aa4aea554d1f4afac7ee0b4915cc6bbc2d6",
      "observed": "2026-09-28T07:45:30Z"
    },
    "0.4.11_20260804": {
      "content": "sha256:c678f212261b482b0413ee95662058bcd7a89265d8f9eff03b4bc7565d5af6f5",
      "observed": "2026-08-04T01:02:01Z"
    },
    "0.4.11": {
      "content": "sha256:c678f212261b482b0413ee95662058bcd7a89265d8f9eff03b4bc7565d5af6f5",
      "observed": "2026-08-04T01:02:01Z"
    },
    "0.4.12_20260804": {
      "content": "sha256:2402c3245f487d3332a324f01ebc3ea43a531c50d784fd7e2e169909936822e7",
      "observed": "2026-08-04T01:02:01Z"
    },
    "0.4.12": {
      "content": "sha256:2402c3245f487d3332a324f01ebc3ea43a531c50d784fd7e2e169909936822e7",
      "observed": "2026-08-04T01:02:01Z"
    },
    "0.4.13_20260810": {
      "content": "sha256:697d8779850da20bae5eb624f5b026d70ff0b61d85dcd71bbdf4fe82567f49bf",
      "observed": "2026-08-10T09:04:35Z"
    },
    "0.4.13": {
      "content": "sha256:697d8779850da20bae5eb624f5b026d70ff0b61d85dcd71bbdf4fe82567f49bf",
      "observed": "2026-08-10T09:04:35Z"
    },
    "0.4.14_20260817": {
      "content": "sha256:7d833ef37803991f637c977b52d04a6e593ee7f8adc7caf5a5fc2cbf7bc7e340",
      "observed": "2026-08-17T08:28:34Z"
    },
    "0.4.14": {
      "content": "sha256:7d833ef37803991f637c977b52d04a6e593ee7f8adc7caf5a5fc2cbf7bc7e340",
      "observed": "2026-08-17T08:28:34Z"
    },
    "0.5.0_20260827": {
      "content": "sha256:33bbc0b6816bffed6ff7332ecc36674a435eab716035c90f6d7fb6576c097ebb",
      "observed": "2026-09-02T21:31:58Z"
    },
    "0.5.0": {
      "content": "sha256:33bbc0b6816bffed6ff7332ecc36674a435eab716035c90f6d7fb6576c097ebb",
      "observed": "2026-09-02T21:31:58Z"
    },
    "0.5": {
      "content": "sha256:c00983250f9cb752faccff07f7d25aa4aea554d1f4afac7ee0b4915cc6bbc2d6",
      "observed": "2026-09-28T07:45:30Z"
    },
    "0.5.1_20260901": {
      "content": "sha256:6deb530056d174a80dd6c67fd2f058db3794b955091917a670dfc13ae32e8492",
      "observed": "2026-09-02T21:31:58Z"
    },
    "0.5.1": {
      "content": "sha256:6deb530056d174a80dd6c67fd2f058db3794b955091917a670dfc13ae32e8492",
      "observed": "2026-09-02T21:31:58Z"
    },
    "0.5.2_20260902": {
      "content": "sha256:73a0e411a5e3cef9a7771e96fef6d923eba655538152cb264b6258f416598c6b",
      "observed": "2026-09-02T22:03:14Z"
    },
    "0.5.2_20260903": {
      "content": "sha256:fd7ea7b60f25808eb0dd841215e56ed4c8c8bbe46db7abe007ccce16d1930ba1",
      "observed": "2026-09-03T06:33:20Z"
    },
    "0.5.2": {
      "content": "sha256:fd7ea7b60f25808eb0dd841215e56ed4c8c8bbe46db7abe007ccce16d1930ba1",
      "observed": "2026-09-03T06:33:20Z"
    },
    "0.5.3_20260913": {
      "content": "sha256:5e8c92fbbad23ea1d13c6e025e7697ebae25a431e72234235b2ba549f4ca4f22",
      "observed": "2026-09-13T12:53:32Z"
    },
    "0.5.3": {
      "content": "sha256:5e8c92fbbad23ea1d13c6e025e7697ebae25a431e72234235b2ba549f4ca4f22",
      "observed": "2026-09-13T12:53:32Z"
    },
    "0.5.4_20260928": {
      "content": "sha256:c00983250f9cb752faccff07f7d25aa4aea554d1f4afac7ee0b4915cc6bbc2d6",
      "observed": "2026-09-28T07:45:30Z"
    },
    "0.5.4": {
      "content": "sha256:c00983250f9cb752faccff07f7d25aa4aea554d1f4afac7ee0b4915cc6bbc2d6",
      "observed": "2026-09-28T07:45:30Z"
    }
  }
}
