{
  "name": "ocx.sh/superfile/superfile",
  "repository": "oci://ghcr.io/ocx-contrib/superfile/superfile",
  "owners": [
    {
      "login": "ocx-bot",
      "id": 309019509
    }
  ],
  "status": "active",
  "deprecated_message": null,
  "created": "2026-08-04",
  "desc": {
    "digest": "sha256:f2a840ab852e5adc20e51875b75ab06597f916fb26c2271001df21748fb4f13c",
    "title": "superfile",
    "description": "Pretty fancy and modern terminal file manager with Vim-style keybindings, tabs, panels, and built-in file preview",
    "keywords": [
      "superfile",
      "spf",
      "file-manager",
      "tui",
      "terminal",
      "files",
      "vim",
      "go",
      "cli"
    ],
    "readme": "sha256:bdf9ad2ac5268145bc066983209eb4d19b6c888327912f064725ad771e5b9ec8",
    "logo": "sha256:3985147334424d2a8fb51f9fe03eae1affbe428925d9fbb9599d18f8c2cdf3ea"
  },
  "upstream": {
    "org": "yorukot",
    "repository_url": "https://github.com/yorukot/superfile",
    "disclaimer": "Unaffiliated mirror. superfile is a project of yorukot; this OCX package republishes upstream release binaries and is not endorsed by them."
  },
  "tags": {
    "1.3.2_20260804": {
      "content": "sha256:0997fc6659c9f10a6967f69c6ad0d46d41c727c8c4a022f6822f6d378f4e7941",
      "observed": "2026-08-04T19:47:04Z"
    },
    "1.3.2": {
      "content": "sha256:0997fc6659c9f10a6967f69c6ad0d46d41c727c8c4a022f6822f6d378f4e7941",
      "observed": "2026-08-04T19:47:04Z"
    },
    "1.3": {
      "content": "sha256:c0de0eca8f80ae91df21efea5c83a4b1c76c9e9655fe9f0c6a01e02dbd133432",
      "observed": "2026-08-04T19:47:04Z"
    },
    "1": {
      "content": "sha256:f91233e05e6384fd3cbcda41200bbecf358f29de07aa4a8652831edd1de15b1b",
      "observed": "2026-08-04T19:47:04Z"
    },
    "latest": {
      "content": "sha256:f91233e05e6384fd3cbcda41200bbecf358f29de07aa4a8652831edd1de15b1b",
      "observed": "2026-08-04T19:47:04Z"
    },
    "1.3.3_20260804": {
      "content": "sha256:c0de0eca8f80ae91df21efea5c83a4b1c76c9e9655fe9f0c6a01e02dbd133432",
      "observed": "2026-08-04T19:47:04Z"
    },
    "1.3.3": {
      "content": "sha256:c0de0eca8f80ae91df21efea5c83a4b1c76c9e9655fe9f0c6a01e02dbd133432",
      "observed": "2026-08-04T19:47:04Z"
    },
    "1.4.0_20260804": {
      "content": "sha256:95ec3746b6064f7299d14a6a35a0456c1749fe68fbf5428fcd3dea707628be28",
      "observed": "2026-08-04T19:47:04Z"
    },
    "1.4.0": {
      "content": "sha256:95ec3746b6064f7299d14a6a35a0456c1749fe68fbf5428fcd3dea707628be28",
      "observed": "2026-08-04T19:47:04Z"
    },
    "1.4": {
      "content": "sha256:95ec3746b6064f7299d14a6a35a0456c1749fe68fbf5428fcd3dea707628be28",
      "observed": "2026-08-04T19:47:04Z"
    },
    "1.5.0_20260804": {
      "content": "sha256:0e00f14f323f1f0852d4c94615a7691d197a16547a8145fd0fb3397b5681d4c7",
      "observed": "2026-08-04T19:47:04Z"
    },
    "1.5.0": {
      "content": "sha256:0e00f14f323f1f0852d4c94615a7691d197a16547a8145fd0fb3397b5681d4c7",
      "observed": "2026-08-04T19:47:04Z"
    },
    "1.5": {
      "content": "sha256:0e00f14f323f1f0852d4c94615a7691d197a16547a8145fd0fb3397b5681d4c7",
      "observed": "2026-08-04T19:47:04Z"
    },
    "1.6.0_20260804": {
      "content": "sha256:f91233e05e6384fd3cbcda41200bbecf358f29de07aa4a8652831edd1de15b1b",
      "observed": "2026-08-04T19:47:04Z"
    },
    "1.6.0": {
      "content": "sha256:f91233e05e6384fd3cbcda41200bbecf358f29de07aa4a8652831edd1de15b1b",
      "observed": "2026-08-04T19:47:04Z"
    },
    "1.6": {
      "content": "sha256:f91233e05e6384fd3cbcda41200bbecf358f29de07aa4a8652831edd1de15b1b",
      "observed": "2026-08-04T19:47:04Z"
    },
    "1.3.0_20260804": {
      "content": "sha256:9244ba3b0f2c89ab37c480281747aa69a1413451715c6583b60bf2401bfe2904",
      "observed": "2026-08-04T19:52:40Z"
    },
    "1.3.0": {
      "content": "sha256:9244ba3b0f2c89ab37c480281747aa69a1413451715c6583b60bf2401bfe2904",
      "observed": "2026-08-04T19:52:40Z"
    },
    "1.3.1_20260804": {
      "content": "sha256:a64571895230318d1ea9b5be6a5495995d85a66ff9b8e91c9a1d9e5cd74d29ec",
      "observed": "2026-08-04T19:52:40Z"
    },
    "1.3.1": {
      "content": "sha256:a64571895230318d1ea9b5be6a5495995d85a66ff9b8e91c9a1d9e5cd74d29ec",
      "observed": "2026-08-04T19:52:40Z"
    }
  }
}
